{
  "provider_id": "finnhub",
  "domain": "earnings",
  "content_domain": "forecast",
  "provider_type": "partner_api",
  "display_name": "Finnhub",
  "base_url": "https://finnhub.io/api/v1",
  "auth_type": "api_key_header",
  "auth_env_var": "FINNHUB_API_KEY",
  "rate_limit_policy": "per_minute",
  "soft_limit": 60,
  "hard_limit": 60,
  "burst_limit": 5,
  "retry_budget": 2,
  "backoff_policy": "exponential",
  "direct_resolution_allowed": true,
  "browse_discovery_allowed": true,
  "supports_bulk_history": false,
  "supports_incremental_refresh": true,
  "supports_direct_resolution": true,
  "supports_public_resolve_if_missing": true,
  "supports_admin_refresh_if_stale": true,
  "graceful_degradation_policy": "defer_and_report",
  "free_tier_notes": "Free tier may throttle near quota boundaries.",
  "fallback_priority": 10,
  "is_active": true,
  "notes": "Reference provider row for the shared registry model."
}
